{
  "$schema": "http://json-schema.org/draft-07/schema#",
  "title": "Field Map",
  "description": "A playable region: the scale at which the player actually walks. Sits under a region and above its points of interest. The terrain is generated from `seed_biomes` by the game's own generator; canon does not describe tiles, only what the place is and what is worth finding in it.",
  "type": "object",
  "required": [
    "id",
    "type",
    "name",
    "region",
    "seed_biomes"
  ],
  "properties": {
    "id": {
      "type": "string",
      "pattern": "^field_map_[a-z0-9_]+$"
    },
    "type": {
      "const": "field_map"
    },
    "name": {
      "type": "string"
    },
    "aliases": {
      "type": "array",
      "items": {
        "type": "string"
      },
      "description": "Other names this has been known by. Added when `Dwarka` became `North Dwarka`: canon held one Dwarka and then held several, and a rename that drops the old name breaks every reference written before it."
    },
    "region": {
      "type": "string",
      "description": "Region entity id this belongs to."
    },
    "seed_biomes": {
      "type": "array",
      "minItems": 1,
      "description": "The biome palette the generator draws terrain from, in rough order of dominance. Ids come from database/biomes.json. This is the only thing canon says about terrain -- layout is the engine's business.",
      "items": {
        "type": "string",
        "enum": [
          "sea",
          "coast",
          "plains",
          "forest",
          "wetland",
          "hills",
          "mountains",
          "snow",
          "desert",
          "river",
          "settlement",
          "landmark",
          "sky_island",
          "sky_underside",
          "sky_water",
          "open_sky",
          "underworld",
          "lava_field"
        ]
      }
    },
    "scale": {
      "type": "string",
      "enum": [
        "small",
        "large"
      ],
      "default": "small",
      "description": "Small maps carry 5-8 points of interest and are learnable in a session; large ones 10-20 with several ecological zones."
    },
    "points_of_interest": {
      "type": "array",
      "items": {
        "type": "string"
      },
      "description": "point_of_interest ids placed on this map. The generator lays terrain; the adapter places these onto it."
    },
    "neighbours": {
      "type": "array",
      "items": {
        "type": "string"
      },
      "description": "field_map ids reachable from here, forming the overworld's travel graph."
    },
    "epochs": {
      "type": "array",
      "items": {
        "type": "string"
      },
      "description": "Epoch ids from database/timeline/epochs.json. Absent means the place exists in every era -- but a settlement standing in one epoch may be a ruin in another, so prefer being explicit."
    },
    "arrival": {
      "type": "string",
      "description": "What the player reads on first entering. Player-facing prose, in the journal's voice."
    },
    "notes": {
      "type": "string",
      "description": "Reference fact for the canon reader. Not shown to the player."
    },
    "canon": {
      "type": "string",
      "enum": [
        "primary",
        "secondary",
        "draft"
      ],
      "default": "primary"
    },
    "sources": {
      "type": "array",
      "items": {
        "type": "string"
      }
    },
    "climate": {
      "type": "object",
      "description": "Relative likelihood of each weather, per spell. Arbitrary units, not percentages. Only the four the world actually produces are allowed: flood and full_moon are in the weather enum but are a state of the land and a phase of the moon, and nothing generates them -- see docs/decisions.md.",
      "additionalProperties": false,
      "properties": {
        "clear": {
          "type": "integer",
          "minimum": 0
        },
        "mist": {
          "type": "integer",
          "minimum": 0
        },
        "rain": {
          "type": "integer",
          "minimum": 0
        },
        "storm": {
          "type": "integer",
          "minimum": 0
        }
      }
    },
    "coordinates": {
      "type": "object",
      "description": "Where this map sits on the overworld, in abstract 0-100 units.\n\nDeliberately not latitude and longitude. Real coordinates invite a real basemap, and this is a post-cataclysm continent with a Shattered Sea and a lava sea where the Ganges was -- a map drawn over modern India would be making a claim canon does not make.\n\nThe layout is cataclysm-shaped rather than geographic: the delta maps cluster in the surviving southwest, the Narmada plateau stands inland at the heart of the continent, the Aravali ranges hold the northern coast where the line crosses to Asia, and the Dry Harbour is far out toward the dead interior. Distance encodes how much of the world was lost, which is what this era is about.",
      "required": [
        "x",
        "y"
      ],
      "properties": {
        "x": {
          "type": "number",
          "minimum": 0,
          "maximum": 100,
          "description": "West to east."
        },
        "y": {
          "type": "number",
          "minimum": 0,
          "maximum": 100,
          "description": "North to south, screen order -- 0 is the top."
        }
      },
      "additionalProperties": false
    },
    "relief": {
      "type": "string",
      "enum": [
        "delta",
        "island",
        "plateau",
        "basin"
      ],
      "default": "basin",
      "description": "The landform, which decides how the generator shapes this map's ground.\n\nCanon does not describe tiles -- it says what kind of place this is, and the engine draws it. This field exists because one shaping rule cannot produce a harbour, an island and a plateau: every map was being built as a dome, low at the rim and high in the middle, so travel cost climbed from 1.15 at the edge to 1.98 at the centre and the walking was hardest exactly where the walking happens.\n\n* `delta`   -- low, wet, threaded with channels. The easy ground is the water's edge.\n* `island`  -- sea on every side, land in the middle. What is left of somewhere larger.\n* `plateau` -- flat and high, severe at the rim. The scarp is the drama, not the surface.\n* `basin`   -- a bowl. The default, and what a seabed becomes when it loses its sea."
    },
    "proportion": {
      "type": "string",
      "enum": [
        "square",
        "portrait"
      ],
      "description": "The shape of the ground, as distinct from its size (`scale`) or its form (`relief`). Absent means square, which is what every map was until a crossing needed otherwise.\n\n`portrait` is for a country that is walked in one direction. The Aravali is a strait: stony shore, water, islands, far shore, in that order, and the whole of it is the journey from one side to the other. Drawn square, the sea has to be wide enough to be a sea in both directions at once, which leaves the shores too thin to hold any relief and the islands too close together to read as two. Drawn tall, the crossing has room to be long without the country having to be wide.\n\nIt is a fact about the place rather than about the screen. A delta spreads and a plateau sits; a crossing runs."
    },
    "vehicles": {
      "type": "array",
      "minItems": 1,
      "uniqueItems": true,
      "items": {
        "type": "string",
        "pattern": "^vehicle_[a-z0-9_]+$"
      },
      "description": "Craft that are simply *here* on this map, lying ready for the traveller from the first morning -- the dugout moored at Lothal, and nothing else yet. vehicle ids, from database/vehicles/.\n\n**What it means, exactly.** A vehicle listed here is part of the country, the way a ford or a landing is: people on this map move this way, and a stranger can too. It is a noun -- *there are dugouts at Lothal* -- so it lives in canon. Everything about using one is a verb and belongs to the game: where it is moored, how boarding works, how fast it goes, and whether the traveller keeps it after stepping ashore.\n\n**What it does not mean.** It is not a recipe and not an unlock. A vehicle absent from this list still exists in canon and can still be built through its `built_by` process where the game supports making; this list only says which ones are already on the water when the traveller arrives. It is also not a claim that the craft works everywhere on the map: a vehicle carries only over its own `crosses` biomes, and the game enforces that.\n\n**Absent means none**, which is what every map was until Lothal. Do not add an empty list.\n\n**Guard.** `lint_story.py` refuses an id here that is not a vehicle, and refuses a vehicle none of whose `crosses` biomes appears in this map's `seed_biomes` -- a boat on a map with no water it can float on is a mistake, and it would ship silently because the game would simply never offer it.\n\nAdded for the dugout on Lothal: the delta is walked by following the channels, and on foot a river is slow going. See docs/decisions.md, *A dugout at Lothal*."
    },
    "departs_from": {
      "type": "array",
      "minItems": 1,
      "items": {
        "type": "string",
        "pattern": "^poi_[a-z0-9_]+$"
      },
      "description": "Where the cart, the boat or the line leaves this map from: the points of interest a traveller must stand at to go on to a neighbour. Each must be on this map. The owner's ruling of 27 September 2026: maps are left from designated places, the way a horse-cart leaves from a yard and not from a field. The first is where a traveller arriving from elsewhere is set down."
    }
  },
  "additionalProperties": false
}
