{
  "id": "field_map_dry_harbour",
  "type": "field_map",
  "name": "The Dry Harbour",
  "region": "region_gedrosian_desert",
  "seed_biomes": [
    "desert",
    "plains",
    "settlement",
    "hills",
    "mountains"
  ],
  "scale": "large",
  "points_of_interest": [
    "poi_mooring_stones",
    "poi_customs_house",
    "poi_last_well",
    "poi_fossil_channel",
    "poi_caravan_camp",
    "poi_glass_scar"
  ],
  "neighbours": [
    "field_map_narmada"
  ],
  "climate": {
    "clear": 80,
    "storm": 11,
    "mist": 5,
    "rain": 4
  },
  "arrival": "The harbour wall runs for four hundred paces and the mooring rings are still in it, at the height a loaded hull would sit. There is no water. There has been no water for long enough that the nearest is two days' walk, and short enough that the rings have not rusted through.",
  "notes": "Fourth field map, and the one about time rather than about knowing. Everything here was built or evolved for a wetter world that ended inside cultural memory, and nothing about it is mysterious -- it is all simply out of date. First map where canon's own species populate the ground: forty Gedrosian species, all placeable. Mountains added to the palette: without them the built map is desert, plains and hills and nothing else, which reads as one flat expanse. They come out at about 2% -- a ridge on the skyline rather than a range, which is the right amount for a map whose subject is a shoreline that is no longer there. Coast and forest were both measured and rejected: coast would put 41% water back on a map about there being none, and forest 19% woodland on a desert. Far east into the dead interior. Placed by measurement as well as by meaning: the first arrangement tried put it at (86, 74), which made the Narmada crossing the longest line on the map while two places that are *not* neighbours sat closer together -- so the drawing would have contradicted the connections it was supposed to show.",
  "epochs": [
    "epoch_post_cataclysm"
  ],
  "canon": "primary",
  "sources": [
    "Varuna's Field Diary design",
    "AI_CONTEXT.md"
  ],
  "coordinates": {
    "x": 92,
    "y": 36
  }
}
